GOID,GOTerm,All Associated Genes
WP:1539,Angiogenesis,"AKT1, ANGPT1, ARNT, CREBBP, FGF2, FGFR2, FLT1, HIF1A, KDR, MAPK1, MAPK14, MMP9, NOS3, PDGFB, PDGFRA, PIK3CA, PLCG1, PTK2, SMAD1, SRC, TEK, TIMP2, TIMP3, VEGFA"
WP:1742,TP53 Network,"ABL1, ATM, BAX, BBC3, BCL2, BID, BOK, CDKN1A, CDKN2A, GADD45A, MDM2, MYC, OTX2, PMAIP1, SUMO1, TNFSF10, TP53, TP63, TP73"
WP:1772,Apoptosis Modulation and Signaling,"AIFM1, AIFM2, APAF1, BAD, BAG3, BAK1, BAX, BBC3, BCL2, BCL2A1, BCL2L1, BCL2L10, BCL2L11, BCL2L2, BID, BIK, BIRC2, BIRC3, BIRC5, BIRC6, BIRC7, BLK, BMF, BOK, CAPNS1, CASP1, CASP10, CASP2, CASP3, CASP4, CASP6, CASP7, CASP8, CASP9, CDKN2A, CFLAR, CRADD, CYCS, DAXX, DFFA, DFFB, DIABLO, ENDOG, FADD, FAS, FASLG, FOS, HN1, HRK, HSPA1A, HTRA2, IKBKB, IL1R1, IL1R2, IRAK1, JUN, MADD, MAP3K14, MAP3K5, MAPK3, MAPK8, MCL1, MYD88, NAIP, NFKB1, NFKBIA, PEA15, PIDD1, PMAIP1, PRKD1, PTPN13, PTRH2, RIPK1, SEPT4, TNFRSF10A, TNFRSF10B, TNFRSF10C, TNFRSF10D, TNFRSF11B, TNFRSF1A, TNFRSF1B, TNFRSF25, TNFRSF6B, TNFSF10, TOLLIP, TP53, TRADD, TRAF3, TRAF6, XIAP"
WP:179,Cell Cycle,"ABL1, APC, ARF1, ATM, ATR, BUB1, BUB1B, BUB3, CCNA1, CCNA2, CCNB1, CCNB2, CCNB3, CCND2, CCND3, CCNE1, CCNE2, CCNH, CDC14A, CDC14B, CDC20, CDC25A, CDC25B, CDC25C, CDC45, CDC6, CDC7, CDH1, CDK1, CDK2, CDK4, CDK6, CDKN1A, CDKN1B, CDKN2A, CHEK1, CHEK2, DBF4, E2F1, E2F2, E2F3, E2F4, E2F5, E2F6, EP300, ESPL1, GADD45A, GSK3B, HDAC1, HDAC2, HDAC3, HDAC4, HDAC5, HDAC6, HDAC7, HDAC8, KITLG, MAD1L1, MAD2L1, MAD2L2, MCM10, MCM2, MCM3, MCM4, MCM5, MCM6, MCM7, MCM8, MCM9, MDM2, MEN1, MPEG1, ORC1, ORC2, ORC3, ORC4, ORC5, ORC6, PCNA, PKMYT1, PLK1, PRKDC, PTTG1, PTTG2, PTTG3P, RB1, RBL1, SKP2, SMAD3, SMAD4, SMC1A, TBC1D8, TFDP1, TGFB1, TP53, UBE2F, WEE1, YWHAB, YWHAE, YWHAG, YWHAH, YWHAQ, YWHAZ"
WP:1971,Integrated Cancer pathway,"AKT1, ATF1, ATM, ATR, BACH1, BAD, BARD1, BAX, BBC3, BCL2, BLM, BRCA1, CASP3, CASP8, CASP9, CDC25A, CDC25B, CDK1, CDK2, CDK4, CDKN1A, CDKN1B, CDKN2B, CHEK1, CHEK2, E2F1, GRIK1-AS2, JAK1, MAP3K5, MDM2, MIR21, MMP1, MRE11A, MSH2, MSH6, MYC, NOXA1, PLK1, POU2F1, PTEN, RAD50, RB1, SMAD2, SMAD3, STAT1, TP53"
WP:2261,Signaling Pathways in Glioblastoma,"AKT1, AKT2, AKT3, ARAF, ATM, BRAF, BRCA1, BRCA2, CBL, CCND1, CCND2, CCNE1, CDK2, CDK4, CDK6, CDKN1A, CDKN1B, CDKN2A, CDKN2B, CDKN2C, E2F1, EGFR, EP300, ERBB2, ERBB3, ERRFI1, FGFR1, FGFR2, FOXO1, FOXO3, FOXO4, GAB1, GRB2, HRAS, IGF1R, IRS1, KRAS, MAP2K1, MAP2K2, MAP2K3, MAP2K4, MAP2K5, MAP2K6, MAP2K7, MAPK1, MAPK3, MDM2, MDM4, MET, MIR21, MSH6, NF1, NRAS, PDGFRA, PDGFRB, PDPK1, PIK3C2A, PIK3C2B, PIK3C2G, PIK3CA, PIK3CB, PIK3CD, PIK3CG, PIK3R1, PIK3R2, PLCG1, PLCG2, PRKCA, PRKCB, PRKCD, PRKCG, PRKCH, PRKCI, PRKCQ, PRKCZ, PTEN, RAF1, RB1, SPRY2, SRC, TP53, TSC1, TSC2"
WP:2446,Retinoblastoma (RB) in Cancer,"ABL1, ANLN, BARD1, CCDC6, CCNA2, CCNB1, CCNB2, CCND1, CCND3, CCNE1, CCNE2, CDC25A, CDC25B, CDC45, CDC7, CDK1, CDK2, CDK4, CDK6, CDKN1A, CDKN1B, CDT1, CHEK1, DCK, DHFR, DNMT1, E2F1, E2F2, E2F3, FAF1, FANCG, H2AFZ, HDAC1, HLTF, HMGB1, HMGB2, KIF4A, MAPK13, MCM3, MCM4, MCM6, MCM7, MDM2, MIR21, MSH6, MYC, NPAT, ORC1, PCNA, PLK4, POLA1, POLD3, POLE, POLE2, PRIM1, PRKDC, PRMT2, RABIF, RAF1, RB1, RBBP4, RBBP7, RBP1, RFC3, RFC4, RFC5, RPA1, RPA2, RPA3, RRM1, RRM2, SAP30, SIN3A, SKP2, SMARCA2, SMC1A, SMC2, SMC3, STMN1, SUV39H1, TFDP1, TFDP2, TOP2A, TP53, TTK, TYMS, WEE1, ZNF655"
WP:254,Apoptosis,"AKT1, APAF1, BAD, BAK1, BAX, BBC3, BCL2, BCL2L1, BCL2L11, BCL2L2, BID, BIRC2, BIRC3, BIRC5, BNIP3L, BOK, CASP1, CASP10, CASP2, CASP3, CASP4, CASP6, CASP7, CASP8, CASP9, CDKN2A, CFLAR, CHUK, CRADD, CYCS, DFFA, DFFB, DIABLO, FADD, FAS, FASLG, GZMB, HELLS, HRK, IGF1, IGF1R, IGF2, IKBKB, IKBKG, IRF1, IRF2, IRF3, IRF4, IRF5, IRF6, IRF7, JUN, LTA, MAP2K4, MAP3K1, MAPK10, MCL1, MDM2, MYC, NFKB1, NFKBIA, NFKBIB, NFKBIE, PIK3R1, PMAIP1, PRF1, RELA, RIPK1, SCAF11, TNF, TNFRSF10B, TNFRSF1A, TNFRSF1B, TNFRSF21, TNFRSF25, TNFSF10, TP53, TP63, TP73, TRADD, TRAF1, TRAF2, TRAF3, XIAP"
WP:466,DNA Replication,"CDC45, CDC6, CDC7, CDK2, CDT1, DBF4, GMNN, MCM10, MCM2, MCM3, MCM4, MCM5, MCM6, MCM7, ORC1, ORC2, ORC3, ORC4, ORC5, ORC6, PCNA, POLA1, POLA2, POLD1, POLD2, POLD3, POLD4, POLE, POLE2, PRIM1, PRIM2, RFC1, RFC2, RFC3, RFC4, RFC5, RPA1, RPA2, RPA3, RPA4, UBA52, UBC"
WP:531,Mismatch repair,"EXO1, LIG1, MLH1, MSH2, MSH6, PCNA, POLD1, RFC1, RPA1"
WP:673,ErbB Signaling Pathway,"ABL1, AKT3, ARAF, AREG, BAD, BCL2L11, BTC, CAMK2A, CBLC, CCND1, CDKN1A, CDKN1B, CRK, EGF, EGFR, EIF4EBP1, ELK1, ERBB2, ERBB3, ERBB4, EREG, FOXO1, GAB1, GRB2, GSK3B, HBEGF, HRAS, JUN, KRAS, MAP2K1, MAP2K7, MAPK1, MAPK8, MDM2, MIR21, MTOR, MYC, NCK1, NRG1, NRG2, NRG3, NRG4, PAK4, PDK1, PIK3R5, PLCG1, PRKCA, PTK2, RPS6KB1, SHC2, SOS1, SRC, STAT5A, TGFA, TP53"
WP:707,DNA Damage Response,"ABL1, APAF1, ATM, ATR, ATRIP, BAX, BBC3, BID, BRCA1, CASP3, CASP8, CASP9, CCNB1, CCNB2, CCNB3, CCND1, CCND2, CCND3, CCNE1, CCNE2, CDC25A, CDC25C, CDK1, CDK2, CDK4, CDK5, CDK6, CDKN1A, CDKN1B, CHEK1, CHEK2, CREB1, CYCS, DDB2, E2F1, FANCD2, FAS, GADD45A, GADD45B, GADD45G, H2AFX, HUS1B, MDM2, MRE11A, MYC, NBN, PIDD1, PMAIP1, PML, PRKDC, RAD1, RAD17, RAD50, RAD51, RAD52, RAD9A, RB1, RFC1, RPA2, RRM2B, SESN1, SFN, SMC1A, TLK1, TLK2, TNFRSF10B, TP53, TP53AIP1"
